first_name,full_name,handle,platform,follower_count,country,email,profile_url,website,description,niche,segment_original,industry,angle_to_take,source_url,raw_context,is_role_based,has_mx,detected_tech
Yoga,Yoga with Urmi Pandya,yogawithurmipandya,youtube,834000,,yogaurmi@gmail.com,https://www.youtube.com/@yogawithurmipandya,,"Namaste! Welcome to YouTube channel of Yoga with Urmi Pandya Urmi Pandya is an International Yoga teacher based out of India. Urmi is currently running Urmi Yoga Academy, teaching Group and Individual training on Ashtanga & Ancient Hatha Yoga. Learn Yoga with Urmi Pandya, connect with us on yogaurmi@gmail.com Website- https://urmipandya.com/",,,,,https://www.youtube.com/@yogawithurmipandya,"dividual training on Ashtanga & Ancient Hatha Yoga. Learn Yoga with Urmi Pandya, connect with us on yogaurmi@gmail.com Website- https://urmipandya.com/",0,,
Kundalini,Kundalini Yoga Tribe,kundaliniyogatribe,youtube,10600,DE,hallo@charan-amrit-kaur.de,https://www.youtube.com/@kundaliniyogatribe,https://www.charan-amrit-kaur.de/yoga-tribe/,"Hallo ihr Lieben, Ich bin Charan Amrit Kaur und habe vor 6 Jahren begonnen meine große Leidenschaft zu teilen: das Kundalini Yoga, Meditation und auch die Sat Nam Rasayan Heilung. Ich bin zertifizierte Yoga-Lehrerin, Heilerin und Rohkostchefin. Das erste Mal habe ich tatsächlich vor 20 Jahren Kundalini Yoga praktiziert und es war Liebe auf den ersten Blick. Die Wirkung auf Körper, Geist und Seele ist unbeschreiblich. Nach einer Stunde fühlt man sich geklärt, ruhig, gelassen und mit seiner Seele verbunden. Die Praxis hat mein Leben so bereichert und meine Entwicklung in allen Bereichen gefördert. Meine Mission ist es die Werkzeuge und die Praxis mit möglichst vielen Menschen zu teilen. Es ist wunderbar für alle Yoga-Anfänger, wie auch für Fortgeschrittene. Tiefe Heilung wird möglich und somit auch wahre Potentialsentfaltung. Viel Freude auf meinem Kanal! Mehr Infos zur Live Praxis findest du hier: www.charan-amrit-kaur.de/yoga-tribe/ Sat Nam!",,,,,https://www.charan-amrit-kaur.de/yoga-tribe/,<a href='mailto:hallo@charan-amrit-kaur.de'> on https://www.charan-amrit-kaur.de/yoga-tribe/,0,,
Kundalini,Kundalini Yoga - Marina Kvataia,kundaliniyoga-marinakvataia,youtube,6870,GE,lotusiyoga@gmail.com,https://www.youtube.com/@kundaliniyoga-marinakvataia,https://www.kundaliniyoga.ge,"მოგესალმებით ჩემს არხზე ჩემო კარგებო! მე ვარ მარინა კვატაია - არჯან ბაქტი კაურ კუნდალინი იოგას საერთაშორისო მასწავლებელი. კლინიკური ფსიქოლოგი, ლაივ ქოუჩი, რეიკის მეორე საფეხურის ინიცირებული ოსტატი და მასაჟის თერაპევტი. ჩემი საავტორო პროექტებით ადამიანები თავიანთ ცხოვრებას ცვლიან უკეთესობისკენ. ჩემი მიზანია მოგაწოდოთ მედიტაციები და იოგას პრაქტიკები,რომელიც ნამდვილად მუშაობს და თქვენს ცხოვრებაში სიმშვიდეს, ჯამრთელობას და წარმატებას შემოიტანს. მე ეს დავამტკიცე ჩემი 10 წლიანი გამოცდილებით და ჩემმა მოსწავლეებმა. ჩემი ვებსაიტია: www.kundaliniyoga.ge სადაც ბევრ საინტერესო ინფორმაციას იხილავთ თუ თქვენ, როგორც მე, შთაგონებული ხართ ამ თემით და გსურთ გააუმჯობესოთ თქვენი ცხოვრება ჩემი პროექტების დახმარებით, გამოიწერეთ ჩემი არხი და დაწერეთ კომენტარებში თქვენი შთაბეჭდილებები, გაუზიარეთ თქვენი საყვარელი ვიდეოები მეგობრებს სოციალურ ქსელებში! ჩემი ტელეგრამი : 👉👉👉 https://t.me/+HmoQhvM-fnxkZjMy ჩემი ინსტაგრამი : 👉👉👉 https://www.instagram.com/kundalini_yoga_mk/",,,,,https://www.kundaliniyoga.ge,E არხზე გადასვლა კონტაქტი ტელეფონი: (+995) 598 407 508 Viber & Whatsapp 0032494 89 77 45 ელ. ფოსტა: Lotusiyoga@gmail.com Find us on: Facebook page opens in new window YouTube page opens in new window Instagram page opens,0,,
Yoga,Yoga with Master D,yogawithmasterd,youtube,6720,IN,rishikeshyogkulam@gmail.com,https://www.youtube.com/@yogawithmasterd,https://www.rishikeshyogkulam.com,"Welcome to yoga with MASTER D! we want to share our yoga knowledge with all yoga students and help many people who want to learn yoga through our high-quality videos. All the level from basic to advance or those who want to be a yoga teacher all are welcome. If you are new to yoga its perfect opportunity for you to learn from basics to advance with complete details. You can find the 30 min of universal yoga sequence and start your practice all the asana will explained one by one in future videos which will help you to understand the asana and will help you to practice safely and develop quickly through your yoga journey. If you are already practicing and suffering with some advance pose like hand stand so stay in tune and comment me what you are suffering with. All I need your love and support and your pretty happy face throughout practice. Sending love and light MASTER – D E- RYT 500, MASTER IN YOGA RISHIKESH YOGKULAM, RISHIKESH, INDIA www.rishikeshyogkulam.com",,,,,https://www.rishikeshyogkulam.com,"Yoga Teacher Training in Rishikesh, India | Best Yoga School rishikeshyogkulam@gmail.com +91 9368154123 (Whatsapp only) Corsi In Italiano Navbar Home About Rishikesh Yogkulam Our Teachers",0,,
Rishikesh,Rishikesh Vinyasa Yoga School,rishikeshvinyasayogaschool,youtube,3560,IN,rishikeshvinyasayogaschool@gmail.com,https://www.youtube.com/@rishikeshvinyasayogaschool,https://www.rishikeshvinyasayogaschool.com,"Vinyasa Yoga 200 Hour Yoga Teacher Training - Rishikesh,India Yoga Alliance,USA accredited RYS 200,USA. www.rishikeshvinyasayogaschool.com",,,,,https://www.rishikeshvinyasayogaschool.com,"Rishikesh Vinyasa Yoga School, Yoga Teacher Training Rishikesh +91-6395949067 rishikeshvinyasayogaschool@gmail.com Home Yoga Courses 100 Hours Yoga Teacher Training 200 Hours Yoga Teacher Training 300 Hours Yoga Te",0,,
Bindusar,Bindusar yoga,bindusaryogarishikesh,youtube,3090,HU,info@yogimukesh.com,https://www.youtube.com/@bindusaryogarishikesh,,"Yoga teacher training 200 and 300 hours in India, Bali and Europe. email us- info@yogimukesh.com",,,,,https://www.youtube.com/@bindusaryogarishikesh,"Yoga teacher training 200 and 300 hours in India, Bali and Europe. email us- info@yogimukesh.com",1,,
Siva,Siva Siddhi Kundalini Yoga Foundation,sivasiddhikundaliniyoga,youtube,1540,IN,sivasiddhi@sivasiddhikundaliniyoga.org,https://www.youtube.com/@sivasiddhikundaliniyoga,https://sivasiddhikundaliniyoga.org/,"Welcome to the official YouTube channel of Siva Siddhi Kundalini Yoga Foundation. Founded by Siddha Yogi Sri Nageswara Maharshi, the organization offers initiation into kundalini meditation and shares the profound spiritual knowledge on how to lead a peaceful and successful life, attain perfection of mind and moksha (self-realization). The organization has been guiding thousands of people since 1995. Sudhamayi amma, a devoted disciple of Nageswara Maharshi, a former gynecologist, dedicated her life to spiritual service for over 30 years, has taken up the responsibility of this divine mission. SUBSCRIBE to this channel for spiritual wisdom and self-transformation - Website: https://sivasiddhikundaliniyoga.org/ Phone: +91 98480 50178 Ashram: Siddha Vidya Peettham, Papavinasanam village, Ghantasala mandal, near Vijayawada, A.P 521332 Meditation Center: Pavan Towers, Gayatri Nagar, Vijayawada, AP Phone: +91 9398102384",,,,,https://sivasiddhikundaliniyoga.org/,"y & Policy Terms & Conditions Shipping & Exchange Cancelation & Refund Contact Us 91-98480 50178 sivasiddhi@sivasiddhikundaliniyoga.org Ashram: Siddha Vidya Peetham Papavinasanam village, Ghantasala mandalam, Krishna district, Andhra P",0,,
Satya,Satya Yoga Ashram,satyayogaashram,youtube,1480,FR,satyayogaashram@gmail.com,https://www.youtube.com/@satyayogaashram,https://www.satyayogaashram.com,"Welcome to Satya Yoga Ashram, a sanctuary for holistic wellness and spiritual growth nestled in the serene landscapes of Rishikesh. Led by Satya, our traditional yoga school offers comprehensive 100hr, 200hr, 300hr Yoga Teacher Training programs in French & English in Rishikesh, India, France & Sri Lanka. We cover Hatha Yoga, Kundalini Yoga, and Mantra Yoga, certified by Yoga Alliance. Immerse yourself in yoga philosophy and practice under experienced instructors. Our courses prepare you to become a certified yoga teacher, while our wellness retreats offer rejuvenation and holistic well-being. Escape the routine and embark on a transformative journey at Satya Yoga Ashram. Join us in promoting wellness, harmony, and spiritual awakening through yoga's ancient wisdom. 🔸 🔸 🔸 🔸 www.satyayogaashram.com",,,,,https://www.satyayogaashram.com,Diapositive 36 (diapositive actuelle) Diapositive 37 Diapositive 37 (diapositive actuelle) Contact satyayogaashram@gmail.com +33 7 83 38 37 31 FRANCE / +91 88 71 87 59 41 INDIA Nous rejoindre sur les réseaux sociaux Emplac,0,,
